record_id,citation,full_text_retrieved,retrieval_notes,human_full_text_decision,full_text_exclusion_reason,study_or_report_type,include_in_evidence_table,notes
REC00201,Emily Leubner; Brooke A Levandowski; Sage Mikami; Theresa Green; Sarah Betstadt (2025). Immediate postplacental intrauterine device placement: retrospective cohort study of expulsion and associated risk factors. AJOG global reports,,,,,,,
REC00202,Deepti Sanku; Caleb Zimmerman; Mahreen Anwar; Payton Wolbert; Nicole Burmeister; Cade Cantu; Neehar Haryadi; Danielle Janowicz; Alexia Lucas; Beth Bailey (2026). Unraveling the Interplay of Race and Geography on Maternal Mortality in the United States. Journal of racial and ethnic health disparities,,,,,,,
REC00203,Ehiremen Adesua Azugbene (2026). Closing the Gap: Advancing Maternal Health Care for Refugee Women in the United States. Journal of immigrant and minority health,,,,,,,
REC00204,"Mohammad Najeh Samara; Kimberly Harry; Aish Barua (2026). Addressing the U.S. maternal health crisis: a systematic review of healthcare access barriers, disparate outcomes, and effective interventions. Frontiers in public health",,,,,,,
REC00205,"Van T Tong; Yalonda Hutchings; Sherry L Farr; Denise D'Angelo; Stephen Babb (2014). State-specific estimates of complete smoke-free home rules among postpartum women, 2010. Preventive medicine",,,,,,,
REC00206,"Sharla M Smith; Shea Kempsen; Claire Metcalf; Oluoma Obi; Elizabeth Madrigal; Kionna L Henderson; Megha Ramaswamy (2026). Closing the Gap Between Recommendation and Uptake: Provider Communication About Low-Dose Aspirin for Preeclampsia Prevention. Journal of pediatrics, perinatology and child health",,,,,,,
REC00207,Joey Berlin; Sean Price (2019). On Call at the Capitol: TMA&#39;s 2019 Legislative Agenda. Texas medicine,,,,,,,
REC00208,Allison Hoynes; Brittany Cox; Roma Amin; Chelsey Foster; Annalise Celano; Jonathan Yun (2026). Is the Availability of Immediate Inpatient Postpartum Long-Acting Reversible Contraception (LARC) Associated with a Decrease in Rapid Repeat Pregnancy? Journal of the American Board of Family Medicine : JABFM,,,,,,,
REC00209,Sarah Gordon; Amelia Whitman; Sarah Sugar; Lucy Chen; Christie Peters; Nancy De Lew; Benjamin D. Sommers (2023). Medicaid After Pregnancy: State-Level Implications of Extending Postpartum Coverage (2023 Update): Issue Brief Medicaid After Pregnancy: State-Level Implications of Extending Postpartum Coverage (2023 Update): Issue Brief,,,,,,,
REC00210,"Jessica Monnet; Julie Hudson (2001). Insurance Status of Mothers at the Time of Birth, by Demographic Characteristics, 2008-2019 Statistical Brief (Medical Expenditure Panel Survey (US))",,,,,,,
REC00211,Mir M. Ali; Kristina D. West; Martin Blanco (2023). Variation Across States in Loss of Medicaid Coverage Among Pregnant Beneficiaries with Substance Use Disorders: Issue Brief Variation Across States in Loss of Medicaid Coverage Among Pregnant Beneficiaries with Substance Use Disorders: Issue Brief,,,,,,,
